<?xml version="1.0"?>
<TSCHSchedule xmlns:xsi="http://www.w3.org/2001/XMLSchema-instance" xsi:schemaLocation="TSCH_SCHEDULE.xsd">
  <!-- Slotframe -->
  <Slotframe macSlotframeSize="101">
    <Link slotOffset="3" channelOffset="1">
		<Option tx="true" rx="false" shared="false"/>
		<Type normal="true" advertising="false" advertisingOnly="false" />
		<Neighbor address="0A:AA:00:00:00:03" />
	</Link>
	<Link slotOffset="10" channelOffset="4">
		<Option tx="true" rx="false" shared="true"/>
		<Type normal="true" advertising="false" advertisingOnly="false" />
		<Neighbor address="0A:AA:00:00:00:03" />
	</Link>
	<Link slotOffset="15" channelOffset="2">
		<Option tx="true" rx="false" shared="true"/>
		<Type normal="true" advertising="false" advertisingOnly="false" />
		<Neighbor address="0A:AA:00:00:00:03" />
	</Link>
  </Slotframe>
</TSCHSchedule>