<?xml version="1.0"?>
<TSCHSchedule xmlns:xsi="http://www.w3.org/2001/XMLSchema-instance" xsi:schemaLocation="TSCH_SCHEDULE.xsd">
  <!-- Slotframe -->
  <Slotframe macSlotframeSize="101">
    <Link slotOffset="1" channelOffset="2">
		<Option tx="false" rx="true" shared="true"/>
		<Type normal="true" advertising="false" advertisingOnly="false" />
		<Neighbor address="0A:AA:00:00:00:02" />
	</Link>
	<Link slotOffset="4" channelOffset="2">
		<Option tx="false" rx="true" shared="true"/>
		<Type normal="true" advertising="false" advertisingOnly="false" />
		<Neighbor address="0A:AA:00:00:00:02" />
	</Link>
	<Link slotOffset="9" channelOffset="2">
		<Option tx="false" rx="true" shared="true"/>
		<Type normal="true" advertising="false" advertisingOnly="false" />
		<Neighbor address="0A:AA:00:00:00:02" />
	</Link>
  </Slotframe>
</TSCHSchedule>