<?xml version="1.0"?>
<TSCHSchedule xmlns:xsi="http://www.w3.org/2001/XMLSchema-instance" xsi:schemaLocation="TSCH_SCHEDULE.xsd">
  <!-- Slotframe -->
  <Slotframe macSlotframeSize="101">
    <Link slotOffset="0" channelOffset="0">
		<Option tx="true" rx="false" shared="false"/>
		<Virtual id="0" />
		<Type normal="true" advertising="false" advertisingOnly="false" />
		<Neighbor address="0A:AA:00:00:00:02" />
	</Link>
	    <Link slotOffset="1" channelOffset="0">
		<Option tx="false" rx="true" shared="false"/>
		<Virtual id="0" />
		<Type normal="true" advertising="false" advertisingOnly="false" />
		<Neighbor address="0A:AA:00:00:00:02" />
	</Link>
	<Link slotOffset="2" channelOffset="0">
		<Option tx="false" rx="true" shared="false"/>
		<Virtual id="1" />
		<Type normal="true" advertising="false" advertisingOnly="false" />
		<Neighbor address="0A:AA:00:00:00:02" />
	</Link>
	<Link slotOffset="3" channelOffset="0">
		<Option tx="true" rx="false" shared="false"/>
		<Virtual id="1" />
		<Type normal="true" advertising="false" advertisingOnly="false" />
		<Neighbor address="0A:AA:00:00:00:02" />
	</Link>
  </Slotframe>
</TSCHSchedule>